CREATE TABLE t(a INT PRIMARY KEY, b CHAR(255) DEFAULT '' NOT NULL, INDEX(b))
ENGINE=INNODB;
BEGIN;
INSERT INTO t SET a=1;
BACKUP SERVER TO '$target_directory';
ROLLBACK;
SELECT * FROM t;
a	b
1	
BEGIN;
DELETE FROM t;
connect backup,localhost,root;
BACKUP SERVER TO 'target_directory';
disconnect backup;
connection default;
ROLLBACK;
SELECT * FROM t;
a	b
1	
DELETE FROM t;
# restart: --defaults-file=MYSQLTEST_VARDIR/some_directory/backup.cnf --datadir=MYSQLTEST_VARDIR/some_directory
SELECT * FROM t;
a	b
1	
DELETE FROM t;
ERROR HY000: Table 't' is read only
# restart
SELECT * FROM t;
a	b
DROP TABLE t;
